{"format":"atelier-package","version":1,"name":"Team structure","generator":"Atelier template library","boards":[{"id":"teamstructure-b1","name":"Team structure","parent":null,"description":"An organisation chart with roles, responsibilities and reporting lines, plus open roles and how teams work together.","color":"theme","cards":[{"id":"teamstructure-c2","type":"heading","x":40,"y":40,"w":1180,"h":67,"title":"Team structure — Porch (next 12 months)","body":"Today’s five people and the four hires planned. Lines show who reports to whom.","color":"paper","tags":[],"comments":[],"items":[],"url":"","media":"","filename":"","boardId":null},{"id":"teamstructure-c3","type":"sticky","x":1260,"y":40,"w":380,"h":200,"title":"How to use this template","body":"One card per role, not per person — the person goes in the body. Dashed-style sand cards are open roles. Keep responsibilities to three bullets each.","color":"sky","tags":[],"comments":[],"items":[],"url":"","media":"","filename":"","boardId":null},{"id":"teamstructure-c4","type":"note","x":740,"y":280,"w":280,"h":133,"title":"CEO — Asha","body":"- Strategy, fundraising\n- Hiring\n- Area partnerships","color":"sand","tags":[],"comments":[],"items":[],"url":"","media":"","filename":"","boardId":null},{"id":"teamstructure-c5","type":"note","x":140,"y":560,"w":280,"h":133,"title":"CTO — Ben","body":"- Architecture\n- Engineering team\n- Security","color":"paper","tags":[],"comments":[],"items":[],"url":"","media":"","filename":"","boardId":null},{"id":"teamstructure-c6","type":"note","x":740,"y":560,"w":280,"h":133,"title":"Head of Design — Chi","body":"- Product design\n- Research\n- Brand","color":"paper","tags":[],"comments":[],"items":[],"url":"","media":"","filename":"","boardId":null},{"id":"teamstructure-c7","type":"note","x":1340,"y":560,"w":280,"h":133,"title":"Community lead — Eli","body":"- Area launches\n- Street hosts\n- Support","color":"paper","tags":[],"comments":[],"items":[],"url":"","media":"","filename":"","boardId":null},{"id":"teamstructure-c8","type":"note","x":40,"y":840,"w":240,"h":87,"title":"Engineer — Dev","body":"App + backend","color":"paper","tags":[],"comments":[],"items":[],"url":"","media":"","filename":"","boardId":null},{"id":"teamstructure-c9","type":"note","x":340,"y":840,"w":240,"h":87,"title":"Engineer (hire Q2)","body":"Mobile","color":"stone","tags":[],"comments":[],"items":[],"url":"","media":"","filename":"","boardId":null},{"id":"teamstructure-ca","type":"note","x":740,"y":840,"w":240,"h":87,"title":"Researcher (hire Q3)","body":"Part-time","color":"stone","tags":[],"comments":[],"items":[],"url":"","media":"","filename":"","boardId":null},{"id":"teamstructure-cb","type":"note","x":1240,"y":840,"w":280,"h":87,"title":"Community managers ×2 (hire Q2)","body":"One per 5 areas","color":"stone","tags":[],"comments":[],"items":[],"url":"","media":"","filename":"","boardId":null}],"edges":[{"id":"teamstructure-ec","from":"teamstructure-c4","to":"teamstructure-c5","label":"","arrow":false,"style":"elbow"},{"id":"teamstructure-ed","from":"teamstructure-c4","to":"teamstructure-c6","label":"","arrow":false,"style":"elbow"},{"id":"teamstructure-ee","from":"teamstructure-c4","to":"teamstructure-c7","label":"","arrow":false,"style":"elbow"},{"id":"teamstructure-ef","from":"teamstructure-c5","to":"teamstructure-c8","label":"","arrow":false,"style":"elbow"},{"id":"teamstructure-eg","from":"teamstructure-c5","to":"teamstructure-c9","label":"","arrow":false,"style":"elbow"},{"id":"teamstructure-eh","from":"teamstructure-c6","to":"teamstructure-ca","label":"","arrow":false,"style":"elbow"},{"id":"teamstructure-ei","from":"teamstructure-c7","to":"teamstructure-cb","label":"","arrow":false,"style":"elbow"}],"view":{"x":60,"y":50,"zoom":0.8},"updated":0,"template":{"id":"lib-team-structure","version":"1.0.0"}}]}