{"format":"atelier-package","version":1,"name":"Podcast outline","generator":"Atelier template library","boards":[{"id":"podcastoutline-b1","name":"Podcast outline","parent":null,"description":"Order talking points into segments with transitions, timings and must-ask questions, ready for the recording.","color":"theme","cards":[{"id":"podcastoutline-c4","type":"column","x":40,"y":280,"w":340,"h":329,"title":"Cold open + intro","body":"","color":"stone","tags":[],"comments":[],"items":[],"url":"","media":"","filename":"","boardId":null},{"id":"podcastoutline-c7","type":"column","x":420,"y":280,"w":380,"h":405,"title":"1 · The shift (18 min)","body":"","color":"stone","tags":[],"comments":[],"items":[],"url":"","media":"","filename":"","boardId":null},{"id":"podcastoutline-ce","type":"column","x":840,"y":280,"w":380,"h":396,"title":"2 · 3 a.m. (8 min)","body":"","color":"stone","tags":[],"comments":[],"items":[],"url":"","media":"","filename":"","boardId":null},{"id":"podcastoutline-ck","type":"column","x":1260,"y":280,"w":380,"h":292,"title":"3 · Daylight (6 min)","body":"","color":"stone","tags":[],"comments":[],"items":[],"url":"","media":"","filename":"","boardId":null},{"id":"podcastoutline-cp","type":"column","x":1680,"y":280,"w":340,"h":445,"title":"Close","body":"","color":"stone","tags":[],"comments":[],"items":[],"url":"","media":"","filename":"","boardId":null},{"id":"podcastoutline-c2","type":"heading","x":40,"y":40,"w":1180,"h":67,"title":"Outline — Ep. 4, the astronomer","body":"Guest runs the night programme at a mountain observatory. Target 36 minutes; record ~60.","color":"paper","tags":[],"comments":[],"items":[],"url":"","media":"","filename":"","boardId":null},{"id":"podcastoutline-c3","type":"sticky","x":1260,"y":40,"w":380,"h":200,"title":"How to use this template","body":"Three segments, each with an opening question, follow-ups and a way out. The bold question in each segment must be asked even if the conversation wanders.","color":"sky","tags":[],"comments":[],"items":[],"url":"","media":"","filename":"","boardId":null},{"id":"podcastoutline-c5","type":"note","x":56,"y":335,"w":308,"h":107,"title":"Cold open","body":"Guest describes the moment the dome opens. Use the sound of the motors under it.","color":"paper","tags":[],"comments":[],"items":[],"url":"","media":"","filename":"","boardId":null,"sectionId":"podcastoutline-c4"},{"id":"podcastoutline-c6","type":"note","x":56,"y":458,"w":308,"h":127,"title":"Intro script","body":"“Tonight, someone whose working day starts when the sun goes down and ends when it threatens to come back…”","color":"paper","tags":[],"comments":[],"items":[],"url":"","media":"","filename":"","boardId":null,"sectionId":"podcastoutline-c4"},{"id":"podcastoutline-c8","type":"task","x":436,"y":335,"w":348,"h":223,"title":"Questions","body":"","color":"paper","tags":[],"comments":[],"items":[{"id":"podcastoutline-i9","text":"**Walk me through tonight, from arrival.**","done":false},{"id":"podcastoutline-ia","text":"What do you do while the telescope is working?","done":false},{"id":"podcastoutline-ib","text":"Who else is awake on the mountain?","done":false},{"id":"podcastoutline-ic","text":"What does cloud do to your mood?","done":false}],"url":"","media":"","filename":"","boardId":null,"sectionId":"podcastoutline-c7"},{"id":"podcastoutline-cd","type":"note","x":436,"y":574,"w":348,"h":87,"title":"Transition","body":"“So when does something strange happen?”","color":"sand","tags":[],"comments":[],"items":[],"url":"","media":"","filename":"","boardId":null,"sectionId":"podcastoutline-c7"},{"id":"podcastoutline-cf","type":"task","x":856,"y":335,"w":348,"h":194,"title":"Questions","body":"","color":"paper","tags":[],"comments":[],"items":[{"id":"podcastoutline-ig","text":"**Tell me about the strangest night.**","done":false},{"id":"podcastoutline-ih","text":"Have you ever seen something you couldn’t explain?","done":false},{"id":"podcastoutline-ii","text":"Is it lonely?","done":false}],"url":"","media":"","filename":"","boardId":null,"sectionId":"podcastoutline-ce"},{"id":"podcastoutline-cj","type":"note","x":856,"y":545,"w":348,"h":107,"title":"Transition","body":"“And when you come down the mountain in daylight…”","color":"sand","tags":[],"comments":[],"items":[],"url":"","media":"","filename":"","boardId":null,"sectionId":"podcastoutline-ce"},{"id":"podcastoutline-cl","type":"task","x":1276,"y":335,"w":348,"h":213,"title":"Questions","body":"","color":"paper","tags":[],"comments":[],"items":[{"id":"podcastoutline-im","text":"**What do daylight people get wrong about the night?**","done":false},{"id":"podcastoutline-in","text":"What do you miss?","done":false},{"id":"podcastoutline-io","text":"What would you tell someone starting night work?","done":false}],"url":"","media":"","filename":"","boardId":null,"sectionId":"podcastoutline-ck"},{"id":"podcastoutline-cq","type":"note","x":1696,"y":335,"w":308,"h":107,"title":"Outro","body":"Thank the guest, tease next week (taxi dispatcher), ask for a review.","color":"paper","tags":[],"comments":[],"items":[],"url":"","media":"","filename":"","boardId":null,"sectionId":"podcastoutline-cp"},{"id":"podcastoutline-cr","type":"image","x":1696,"y":458,"w":308,"h":243,"title":"The observatory","body":"","color":"paper","tags":[],"comments":[],"items":[],"url":"","media":"@image:ph-pod-observatory","filename":"ph-pod-observatory.jpg","boardId":null,"sectionId":"podcastoutline-cp"}],"edges":[],"view":{"x":60,"y":50,"zoom":0.8},"updated":0,"template":{"id":"lib-podcast-outline","version":"1.0.0"}}]}