{"format":"atelier-package","version":1,"name":"Character relationship map","generator":"Atelier template library","boards":[{"id":"characterrelationshipmap-b1","name":"Character relationship map","parent":null,"description":"Map how characters are connected — family, loyalty, secrets, debts and rivalries — with labelled connectors you can rearrange.","color":"theme","cards":[{"id":"characterrelationshipmap-c2","type":"heading","x":40,"y":40,"w":1180,"h":67,"title":"Who is connected to whom — Kesh","body":"Six characters, the ties between them, and the secrets that change those ties during the book.","color":"paper","tags":[],"comments":[],"items":[],"url":"","media":"","filename":"","boardId":null},{"id":"characterrelationshipmap-c3","type":"sticky","x":1260,"y":40,"w":380,"h":200,"title":"How to use this template","body":"Each line is a relationship; its label says what it is now. When a secret is revealed, add a dashed second connector with the new truth.","color":"sky","tags":[],"comments":[],"items":[],"url":"","media":"","filename":"","boardId":null},{"id":"characterrelationshipmap-c4","type":"note","x":740,"y":280,"w":240,"h":107,"title":"Zsófia Varga","body":"The grandmother. Dead from ch. 1, present everywhere.","color":"sand","tags":[],"comments":[],"items":[],"url":"","media":"","filename":"","boardId":null},{"id":"characterrelationshipmap-c5","type":"note","x":300,"y":540,"w":240,"h":107,"title":"Ines Varga","body":"Protagonist. Came back for a week.","color":"sky","tags":[],"comments":[],"items":[],"url":"","media":"","filename":"","boardId":null},{"id":"characterrelationshipmap-c6","type":"note","x":1220,"y":540,"w":240,"h":87,"title":"Tomas Varga","body":"Stayed. Keeps the furnace lit.","color":"sky","tags":[],"comments":[],"items":[],"url":"","media":"","filename":"","boardId":null},{"id":"characterrelationshipmap-c7","type":"note","x":1040,"y":920,"w":240,"h":107,"title":"Edwin Hale","body":"Mainland collector. Zsófia’s son — hidden.","color":"rose","tags":[],"comments":[],"items":[],"url":"","media":"","filename":"","boardId":null},{"id":"characterrelationshipmap-c8","type":"note","x":40,"y":880,"w":240,"h":107,"title":"Pell","body":"Ferryman. Knows who comes and goes.","color":"paper","tags":[],"comments":[],"items":[],"url":"","media":"","filename":"","boardId":null},{"id":"characterrelationshipmap-c9","type":"note","x":1520,"y":1080,"w":240,"h":107,"title":"Dr Mirela Kos","body":"Island doctor. Signed the death certificate.","color":"paper","tags":[],"comments":[],"items":[],"url":"","media":"","filename":"","boardId":null},{"id":"characterrelationshipmap-ca","type":"note","x":300,"y":1100,"w":300,"h":127,"title":"Key","body":"Solid line: known relationship. Label after the slash: the truth revealed later.","color":"plain","tags":[],"comments":[],"items":[],"url":"","media":"","filename":"","boardId":null}],"edges":[{"id":"characterrelationshipmap-eb","from":"characterrelationshipmap-c4","to":"characterrelationshipmap-c5","label":"raised / favourite"},{"id":"characterrelationshipmap-ec","from":"characterrelationshipmap-c4","to":"characterrelationshipmap-c6","label":"raised / heir"},{"id":"characterrelationshipmap-ed","from":"characterrelationshipmap-c5","to":"characterrelationshipmap-c6","label":"siblings — estranged"},{"id":"characterrelationshipmap-ee","from":"characterrelationshipmap-c4","to":"characterrelationshipmap-c7","label":"“old friend” / mother","style":"straight"},{"id":"characterrelationshipmap-ef","from":"characterrelationshipmap-c7","to":"characterrelationshipmap-c5","label":"rival / uncle"},{"id":"characterrelationshipmap-eg","from":"characterrelationshipmap-c8","to":"characterrelationshipmap-c5","label":"old friend"},{"id":"characterrelationshipmap-eh","from":"characterrelationshipmap-c9","to":"characterrelationshipmap-c4","label":"doctor / kept her secret"},{"id":"characterrelationshipmap-ei","from":"characterrelationshipmap-c6","to":"characterrelationshipmap-c7","label":"wants to sell to"}],"view":{"x":60,"y":50,"zoom":0.8},"updated":0,"template":{"id":"lib-character-relationship-map","version":"1.0.0"}}]}