{"format":"atelier-package","version":1,"name":"Podcast episode plan","generator":"Atelier template library","boards":[{"id":"podcastepisodeplan-b1","name":"Podcast episode plan","parent":null,"description":"Plan one episode from idea to publish: guest, angle, research, outline, recording logistics and release tasks on a two-week calendar.","color":"theme","cards":[{"id":"podcastepisodeplan-c4","type":"column","x":40,"y":280,"w":320,"h":441,"title":"Guest","body":"","color":"stone","tags":[],"comments":[],"items":[],"url":"","media":"","filename":"","boardId":null},{"id":"podcastepisodeplan-c7","type":"column","x":400,"y":280,"w":320,"h":349,"title":"Angle","body":"","color":"stone","tags":[],"comments":[],"items":[],"url":"","media":"","filename":"","boardId":null},{"id":"podcastepisodeplan-ca","type":"column","x":760,"y":280,"w":320,"h":379,"title":"Research","body":"","color":"stone","tags":[],"comments":[],"items":[],"url":"","media":"","filename":"","boardId":null},{"id":"podcastepisodeplan-cd","type":"column","x":1120,"y":280,"w":340,"h":341,"title":"Outline","body":"","color":"stone","tags":[],"comments":[],"items":[],"url":"","media":"","filename":"","boardId":null},{"id":"podcastepisodeplan-cl","type":"column","x":1500,"y":280,"w":340,"h":448,"title":"Recording","body":"","color":"stone","tags":[],"comments":[],"items":[],"url":"","media":"","filename":"","boardId":null},{"id":"podcastepisodeplan-c2","type":"heading","x":40,"y":40,"w":1180,"h":67,"title":"Small Hours · Ep. 3 — the tug pilot","body":"Guest: a harbour tug pilot who guides container ships into port at night. Record on the boat if the harbour allows it.","color":"paper","tags":[],"comments":[],"items":[],"url":"","media":"","filename":"","boardId":null},{"id":"podcastepisodeplan-c3","type":"sticky","x":1260,"y":40,"w":380,"h":200,"title":"How to use this template","body":"Fill the angle before the research — it stops the episode becoming a job description. Move cards on the calendar as the recording date firms up.","color":"sky","tags":[],"comments":[],"items":[],"url":"","media":"","filename":"","boardId":null},{"id":"podcastepisodeplan-c5","type":"note","x":56,"y":335,"w":288,"h":127,"title":"Who","body":"**Maggie R.**, 52. Tug pilot for 19 years, one of four women doing the job in the port.","color":"paper","tags":[],"comments":[],"items":[],"url":"","media":"","filename":"","boardId":null,"sectionId":"podcastepisodeplan-c4"},{"id":"podcastepisodeplan-c6","type":"image","x":56,"y":478,"w":288,"h":219,"title":"Her tug","body":"","color":"paper","tags":[],"comments":[],"items":[],"url":"","media":"@image:ph-pod-tugboat","filename":"ph-pod-tugboat.jpg","boardId":null,"sectionId":"podcastepisodeplan-c4"},{"id":"podcastepisodeplan-c8","type":"note","x":416,"y":335,"w":288,"h":127,"title":"The episode is about","body":"Steering something 400 times your size by feel — and what that does to how you see the world.","color":"sand","tags":[],"comments":[],"items":[],"url":"","media":"","filename":"","boardId":null,"sectionId":"podcastepisodeplan-c7"},{"id":"podcastepisodeplan-c9","type":"note","x":416,"y":478,"w":288,"h":127,"title":"Avoid","body":"A list of ship sizes and engine specs. Use one number, the most astonishing one.","color":"paper","tags":[],"comments":[],"items":[],"url":"","media":"","filename":"","boardId":null,"sectionId":"podcastepisodeplan-c7"},{"id":"podcastepisodeplan-cb","type":"link","x":776,"y":335,"w":288,"h":137,"title":"How tugboats work","body":"Types, bollard pull, escort work.","color":"paper","tags":[],"comments":[],"items":[],"url":"https://en.wikipedia.org/wiki/Tugboat","media":"","filename":"","boardId":null,"sectionId":"podcastepisodeplan-ca"},{"id":"podcastepisodeplan-cc","type":"note","x":776,"y":488,"w":288,"h":147,"title":"Pre-interview notes","body":"Calls the ships “the big girls”. Once spent 11 hours holding a ship off a pier in a storm. Hates the word “brave”.","color":"paper","tags":[],"comments":[],"items":[],"url":"","media":"","filename":"","boardId":null,"sectionId":"podcastepisodeplan-ca"},{"id":"podcastepisodeplan-ce","type":"task","x":1136,"y":335,"w":308,"h":262,"title":"Outline","body":"","color":"paper","tags":[],"comments":[],"items":[{"id":"podcastepisodeplan-if","text":"Cold open: the horn, 2 a.m.","done":false},{"id":"podcastepisodeplan-ig","text":"How she got here","done":false},{"id":"podcastepisodeplan-ih","text":"A normal night, minute by minute","done":false},{"id":"podcastepisodeplan-ii","text":"The storm night","done":false},{"id":"podcastepisodeplan-ij","text":"What daylight people get wrong","done":false},{"id":"podcastepisodeplan-ik","text":"What she’ll do when she stops","done":false}],"url":"","media":"","filename":"","boardId":null,"sectionId":"podcastepisodeplan-cd"},{"id":"podcastepisodeplan-cm","type":"table","x":1516,"y":335,"w":308,"h":369,"title":"Logistics","body":"","color":"paper","tags":[],"comments":[],"items":[],"url":"","media":"","filename":"","boardId":null,"cells":[["","Plan"],["Where","On the tug, then the crew room"],["When","Night shift, Thu 22:00"],["Kit","2 lav mics, recorder, deadcats"],["Safety","Lifejackets, harbour approval"],["Backup","Crew room only, if weather"]],"sectionId":"podcastepisodeplan-cl"},{"id":"podcastepisodeplan-cn","type":"timeline","x":40,"y":776,"w":1780,"h":380,"title":"Two weeks to release","body":"","color":"paper","tags":[],"comments":[],"items":[],"url":"","media":"","filename":"","boardId":null,"timeline":{"mode":"date","fps":[24,1],"drop":false,"start":20458,"end":20472,"links":false,"items":[{"id":"podcastepisodeplan-tu","card":"podcastepisodeplan-co","at":20458,"len":2,"lane":0},{"id":"podcastepisodeplan-tv","card":"podcastepisodeplan-cp","at":20461,"len":1,"lane":1},{"id":"podcastepisodeplan-tw","card":"podcastepisodeplan-cq","at":20462,"len":4,"lane":0},{"id":"podcastepisodeplan-tx","card":"podcastepisodeplan-cr","at":20466,"len":2,"lane":1},{"id":"podcastepisodeplan-ty","card":"podcastepisodeplan-cs","at":20468,"len":1,"lane":2},{"id":"podcastepisodeplan-tz","card":"podcastepisodeplan-ct","at":20470,"len":1,"lane":0}]}},{"id":"podcastepisodeplan-co","type":"note","x":40,"y":1204,"w":282,"h":87,"title":"Research + pre-interview","body":"","color":"paper","tags":[],"comments":[],"items":[],"url":"","media":"","filename":"","boardId":null},{"id":"podcastepisodeplan-cp","type":"note","x":340,"y":1204,"w":282,"h":87,"title":"Record on the tug","body":"","color":"sand","tags":[],"comments":[],"items":[],"url":"","media":"","filename":"","boardId":null},{"id":"podcastepisodeplan-cq","type":"note","x":640,"y":1204,"w":282,"h":87,"title":"Edit","body":"Rough cut 50 min → 36.","color":"paper","tags":[],"comments":[],"items":[],"url":"","media":"","filename":"","boardId":null},{"id":"podcastepisodeplan-cr","type":"note","x":940,"y":1204,"w":282,"h":87,"title":"Mix + music","body":"","color":"paper","tags":[],"comments":[],"items":[],"url":"","media":"","filename":"","boardId":null},{"id":"podcastepisodeplan-cs","type":"note","x":1240,"y":1204,"w":282,"h":87,"title":"Show notes, transcript, artwork","body":"","color":"paper","tags":[],"comments":[],"items":[],"url":"","media":"","filename":"","boardId":null},{"id":"podcastepisodeplan-ct","type":"note","x":1540,"y":1204,"w":282,"h":87,"title":"Release Tue 23:00","body":"","color":"sage","tags":[],"comments":[],"items":[],"url":"","media":"","filename":"","boardId":null}],"edges":[],"view":{"x":60,"y":50,"zoom":0.8},"updated":0,"template":{"id":"lib-podcast-episode-plan","version":"1.0.0"}}]}