{"format":"atelier-package","version":1,"name":"Photography moodboard","generator":"Atelier template library","boards":[{"id":"photographymoodboard-b1","name":"Photography moodboard","parent":null,"description":"Plan the look of a shoot: light, composition, colour grading, styling and the frames you must come back with.","color":"theme","cards":[{"id":"photographymoodboard-c4","type":"column","x":40,"y":299,"w":340,"h":472,"title":"Unhurried","body":"","color":"stone","tags":[],"comments":[],"items":[],"url":"","media":"","filename":"","boardId":null},{"id":"photographymoodboard-cf","type":"column","x":40,"y":875,"w":360,"h":574,"title":"Colour","body":"","color":"stone","tags":[],"comments":[],"items":[],"url":"","media":"","filename":"","boardId":null},{"id":"photographymoodboard-cm","type":"column","x":440,"y":875,"w":420,"h":360,"title":"Type","body":"","color":"stone","tags":[],"comments":[],"items":[],"url":"","media":"","filename":"","boardId":null},{"id":"photographymoodboard-co","type":"column","x":900,"y":875,"w":360,"h":607,"title":"Texture & detail","body":"","color":"stone","tags":[],"comments":[],"items":[],"url":"","media":"","filename":"","boardId":null},{"id":"photographymoodboard-cr","type":"column","x":1300,"y":875,"w":340,"h":361,"title":"Use / avoid","body":"","color":"stone","tags":[],"comments":[],"items":[],"url":"","media":"","filename":"","boardId":null},{"id":"photographymoodboard-cu","type":"column","x":1680,"y":875,"w":360,"h":341,"title":"Must-get frames","body":"","color":"stone","tags":[],"comments":[],"items":[],"url":"","media":"","filename":"","boardId":null},{"id":"photographymoodboard-c2","type":"heading","x":40,"y":40,"w":1180,"h":67,"title":"“Slow Mornings” — editorial shoot","body":"Eight-page editorial for a homeware brand: linen, ceramics and coffee in a sunlit flat. Natural light only.","color":"paper","tags":[],"comments":[],"items":[],"url":"","media":"","filename":"","boardId":null},{"id":"photographymoodboard-c3","type":"sticky","x":1260,"y":40,"w":380,"h":219,"title":"How to use this template","body":"Collect widely, then edit hard: keep only references that say something the others don’t. Under each image, note what to borrow — the light, the colour, the composition — so the board guides decisions rather than just looking nice.","color":"sky","tags":[],"comments":[],"items":[],"url":"","media":"","filename":"","boardId":null},{"id":"photographymoodboard-c5","type":"note","x":56,"y":354,"w":308,"h":127,"title":"The feeling","body":"Sunday, 8 a.m. Light falls across a table nobody has cleared yet. The images should smell of coffee and clean cotton.","color":"sand","tags":[],"comments":[],"items":[],"url":"","media":"","filename":"","boardId":null,"sectionId":"photographymoodboard-c4"},{"id":"photographymoodboard-c6","type":"note","x":56,"y":497,"w":308,"h":107,"title":"Words","body":"Soft · lived-in · low sun · tactile · quiet","color":"paper","tags":[],"comments":[],"items":[],"url":"","media":"","filename":"","boardId":null,"sectionId":"photographymoodboard-c4"},{"id":"photographymoodboard-c7","type":"note","x":56,"y":620,"w":308,"h":127,"title":"Light","body":"East-facing windows, 7:30–10:00. Bounce only; no strobes. Let highlights clip on white linen.","color":"paper","tags":[],"comments":[],"items":[],"url":"","media":"","filename":"","boardId":null,"sectionId":"photographymoodboard-c4"},{"id":"photographymoodboard-c8","type":"image","x":420,"y":299,"w":560,"h":432,"title":"Hero light — borrow exactly this","body":"","color":"paper","tags":[],"comments":[],"items":[],"url":"","media":"@image:ph-ph-morning-table","filename":"ph-ph-morning-table.jpg","boardId":null},{"id":"photographymoodboard-c9","type":"image","x":1020,"y":299,"w":270,"h":256,"title":"Linen in raking light","body":"","color":"paper","tags":[],"comments":[],"items":[],"url":"","media":"@image:ph-ph-linen-bed","filename":"ph-ph-linen-bed.jpg","boardId":null},{"id":"photographymoodboard-ca","type":"image","x":1306,"y":299,"w":270,"h":256,"title":"Ceramics, close","body":"","color":"paper","tags":[],"comments":[],"items":[],"url":"","media":"@image:ph-ph-ceramic-cups","filename":"ph-ph-ceramic-cups.jpg","boardId":null},{"id":"photographymoodboard-cb","type":"image","x":1592,"y":299,"w":270,"h":256,"title":"Window shadows","body":"","color":"paper","tags":[],"comments":[],"items":[],"url":"","media":"@image:ph-ph-window-shadow","filename":"ph-ph-window-shadow.jpg","boardId":null},{"id":"photographymoodboard-cc","type":"image","x":1020,"y":571,"w":270,"h":256,"title":"Human, not posed","body":"","color":"paper","tags":[],"comments":[],"items":[],"url":"","media":"@image:ph-ph-hands-coffee","filename":"ph-ph-hands-coffee.jpg","boardId":null},{"id":"photographymoodboard-cd","type":"image","x":1306,"y":571,"w":270,"h":256,"title":"Greenery accents","body":"","color":"paper","tags":[],"comments":[],"items":[],"url":"","media":"@image:ph-ph-plants-window","filename":"ph-ph-plants-window.jpg","boardId":null},{"id":"photographymoodboard-ce","type":"image","x":1592,"y":571,"w":270,"h":256,"title":"Food styling","body":"","color":"paper","tags":[],"comments":[],"items":[],"url":"","media":"@image:ph-ph-bread-board","filename":"ph-ph-bread-board.jpg","boardId":null},{"id":"photographymoodboard-cg","type":"image","x":56,"y":930,"w":156,"h":157,"title":"Linen · #F4EFE6","body":"","color":"paper","tags":[],"comments":[],"items":[],"url":"","media":"@image:gen-swatch-f4efe6-linen-s","filename":"gen-swatch-f4efe6-linen-s.png","boardId":null,"sectionId":"photographymoodboard-cf"},{"id":"photographymoodboard-ch","type":"image","x":224,"y":930,"w":156,"h":157,"title":"Oat · #D9C3A5","body":"","color":"paper","tags":[],"comments":[],"items":[],"url":"","media":"@image:gen-swatch-d9c3a5-oat-s","filename":"gen-swatch-d9c3a5-oat-s.png","boardId":null,"sectionId":"photographymoodboard-cf"},{"id":"photographymoodboard-ci","type":"image","x":56,"y":1099,"w":156,"h":157,"title":"Clay · #A9714B","body":"","color":"paper","tags":[],"comments":[],"items":[],"url":"","media":"@image:gen-swatch-a9714b-clay-s","filename":"gen-swatch-a9714b-clay-s.png","boardId":null,"sectionId":"photographymoodboard-cf"},{"id":"photographymoodboard-cj","type":"image","x":224,"y":1099,"w":156,"h":157,"title":"Sage · #6B705C","body":"","color":"paper","tags":[],"comments":[],"items":[],"url":"","media":"@image:gen-swatch-6b705c-sage-s","filename":"gen-swatch-6b705c-sage-s.png","boardId":null,"sectionId":"photographymoodboard-cf"},{"id":"photographymoodboard-ck","type":"image","x":56,"y":1268,"w":156,"h":157,"title":"Charcoal · #3A3A3A","body":"","color":"paper","tags":[],"comments":[],"items":[],"url":"","media":"@image:gen-swatch-3a3a3a-charcoal-s","filename":"gen-swatch-3a3a3a-charcoal-s.png","boardId":null,"sectionId":"photographymoodboard-cf"},{"id":"photographymoodboard-cl","type":"image","x":224,"y":1268,"w":156,"h":157,"title":"Morning light · #E8D5B7","body":"","color":"paper","tags":[],"comments":[],"items":[],"url":"","media":"@image:gen-swatch-e8d5b7-morninglight-s","filename":"gen-swatch-e8d5b7-morninglight-s.png","boardId":null,"sectionId":"photographymoodboard-cf"},{"id":"photographymoodboard-cn","type":"image","x":456,"y":930,"w":388,"h":281,"title":"Headline: Fraunces","body":"","color":"paper","tags":[],"comments":[],"items":[],"url":"","media":"@image:gen-type-00817135e9","filename":"gen-type-00817135e9.png","boardId":null,"sectionId":"photographymoodboard-cm"},{"id":"photographymoodboard-cp","type":"image","x":916,"y":930,"w":328,"h":256,"title":"Texture: crumpled, not ironed","body":"","color":"paper","tags":[],"comments":[],"items":[],"url":"","media":"@image:ph-ph-linen-texture","filename":"ph-ph-linen-texture.jpg","boardId":null,"sectionId":"photographymoodboard-co"},{"id":"photographymoodboard-cq","type":"image","x":916,"y":1202,"w":328,"h":256,"title":"Surface: worn oak","body":"","color":"paper","tags":[],"comments":[],"items":[],"url":"","media":"@image:ph-ph-wood-grain","filename":"ph-ph-wood-grain.jpg","boardId":null,"sectionId":"photographymoodboard-co"},{"id":"photographymoodboard-cs","type":"note","x":1316,"y":930,"w":308,"h":133,"title":"Use","body":"- Raking light, long shadows\n- Shallow depth of field (f/2–2.8)\n- Hands and half-finished moments","color":"sage","tags":[],"comments":[],"items":[],"url":"","media":"","filename":"","boardId":null,"sectionId":"photographymoodboard-cr"},{"id":"photographymoodboard-ct","type":"note","x":1316,"y":1079,"w":308,"h":133,"title":"Avoid","body":"- Perfectly made beds\n- Cool white balance\n- Props with visible logos","color":"rose","tags":[],"comments":[],"items":[],"url":"","media":"","filename":"","boardId":null,"sectionId":"photographymoodboard-cr"},{"id":"photographymoodboard-cv","type":"task","x":1696,"y":930,"w":328,"h":262,"title":"Shot list","body":"","color":"paper","tags":[],"comments":[],"items":[{"id":"photographymoodboard-iw","text":"Hero table, wide, 4:5","done":false},{"id":"photographymoodboard-ix","text":"Bed detail, linen in light","done":false},{"id":"photographymoodboard-iy","text":"Hands + cup, close","done":false},{"id":"photographymoodboard-iz","text":"Ceramics flat-lay","done":false},{"id":"photographymoodboard-i10","text":"Window + plant, vertical for cover","done":false},{"id":"photographymoodboard-i11","text":"Pour shot (coffee), 1/500","done":false}],"url":"","media":"","filename":"","boardId":null,"sectionId":"photographymoodboard-cu"}],"edges":[],"view":{"x":60,"y":50,"zoom":0.8},"updated":0,"template":{"id":"lib-photography-moodboard","version":"1.0.0"}}]}