{"format":"atelier-package","version":1,"name":"Game marketing plan","generator":"Atelier template library","boards":[{"id":"gamemarketingplan-b1","name":"Game marketing plan","parent":null,"description":"Plan a game’s launch from announcement to post-launch: audience, hooks, wishlists, festivals, creators, press and a calendar.","color":"theme","cards":[{"id":"gamemarketingplan-c4","type":"column","x":40,"y":280,"w":340,"h":309,"title":"Audience","body":"","color":"stone","tags":[],"comments":[],"items":[],"url":"","media":"","filename":"","boardId":null},{"id":"gamemarketingplan-c7","type":"column","x":420,"y":280,"w":340,"h":599,"title":"Assets","body":"","color":"stone","tags":[],"comments":[],"items":[],"url":"","media":"","filename":"","boardId":null},{"id":"gamemarketingplan-cf","type":"column","x":800,"y":280,"w":340,"h":353,"title":"Channels","body":"","color":"stone","tags":[],"comments":[],"items":[],"url":"","media":"","filename":"","boardId":null},{"id":"gamemarketingplan-ch","type":"column","x":1180,"y":280,"w":340,"h":586,"title":"Targets","body":"","color":"stone","tags":[],"comments":[],"items":[],"url":"","media":"","filename":"","boardId":null},{"id":"gamemarketingplan-c2","type":"heading","x":40,"y":40,"w":1180,"h":67,"title":"Launch plan — Tidewater","body":"Indie launch on PC and Switch. Wishlists are the goal before launch; reviews and word of mouth after.","color":"paper","tags":[],"comments":[],"items":[],"url":"","media":"","filename":"","boardId":null},{"id":"gamemarketingplan-c3","type":"sticky","x":1260,"y":40,"w":380,"h":200,"title":"How to use this template","body":"Build around beats (announce, demo, festival, date, launch) with quiet steady content between them. Track wishlists weekly — they predict launch sales.","color":"sky","tags":[],"comments":[],"items":[],"url":"","media":"","filename":"","boardId":null},{"id":"gamemarketingplan-c5","type":"note","x":56,"y":335,"w":308,"h":107,"title":"Players","body":"Cosy-game fans, puzzle lovers, players of short story games. 20–40.","color":"paper","tags":[],"comments":[],"items":[],"url":"","media":"","filename":"","boardId":null,"sectionId":"gamemarketingplan-c4"},{"id":"gamemarketingplan-c6","type":"note","x":56,"y":458,"w":308,"h":107,"title":"Hook","body":"“Turn the tide to solve puzzles on islands that vanish.”","color":"sand","tags":[],"comments":[],"items":[],"url":"","media":"","filename":"","boardId":null,"sectionId":"gamemarketingplan-c4"},{"id":"gamemarketingplan-c8","type":"task","x":436,"y":335,"w":308,"h":233,"title":"Assets","body":"","color":"paper","tags":[],"comments":[],"items":[{"id":"gamemarketingplan-i9","text":"Announcement trailer (60 s)","done":false},{"id":"gamemarketingplan-ia","text":"Store page + capsule art","done":false},{"id":"gamemarketingplan-ib","text":"GIFs of every tide puzzle","done":false},{"id":"gamemarketingplan-ic","text":"Demo (island 1)","done":false},{"id":"gamemarketingplan-id","text":"Press kit","done":false}],"url":"","media":"","filename":"","boardId":null,"sectionId":"gamemarketingplan-c7"},{"id":"gamemarketingplan-ce","type":"image","x":436,"y":584,"w":308,"h":271,"title":"Key art reference","body":"Photo: Cramond Island Tidal Causeway - geograph.org.uk - 8149960 — John Walton. CC BY-SA 2.0, via Wikimedia Commons.","color":"paper","tags":[],"comments":[],"items":[],"url":"https://commons.wikimedia.org/wiki/File:Cramond_Island_Tidal_Causeway_-_geograph.org.uk_-_8149960.jpg","media":"@image:ph-gm-low-tide","filename":"ph-gm-low-tide.jpg","boardId":null,"sectionId":"gamemarketingplan-c7"},{"id":"gamemarketingplan-cg","type":"table","x":816,"y":335,"w":308,"h":274,"title":"Mix","body":"","color":"paper","tags":[],"comments":[],"items":[],"url":"","media":"","filename":"","boardId":null,"cells":[["Channel","Role"],["Store page","Wishlists"],["Festivals","Demo players"],["Creators","Reach"],["Social GIFs","Steady interest"],["Press","Launch reviews"]],"sectionId":"gamemarketingplan-cf"},{"id":"gamemarketingplan-ci","type":"table","x":1196,"y":335,"w":308,"h":279,"title":"Targets","body":"","color":"paper","tags":[],"comments":[],"items":[],"url":"","media":"","filename":"","boardId":null,"cells":[["Metric","Target"],["Wishlists at launch","40,000"],["Demo players","15,000"],["Creators covering","60"],["Reviews (week 1)","300"]],"sectionId":"gamemarketingplan-ch"},{"id":"gamemarketingplan-cj","type":"image","x":1196,"y":630,"w":308,"h":212,"title":"Wishlist target curve","body":"","color":"paper","tags":[],"comments":[],"items":[],"url":"","media":"@image:gen-chart-bc2ee868ee","filename":"gen-chart-bc2ee868ee.png","boardId":null,"sectionId":"gamemarketingplan-ch"},{"id":"gamemarketingplan-ck","type":"timeline","x":40,"y":927,"w":1460,"h":380,"title":"Six months to launch","body":"","color":"paper","tags":[],"comments":[],"items":[],"url":"","media":"","filename":"","boardId":null,"timeline":{"mode":"date","fps":[24,1],"drop":false,"start":20458,"end":20658,"links":false,"items":[{"id":"gamemarketingplan-tr","card":"gamemarketingplan-cl","at":20458,"len":7,"lane":0},{"id":"gamemarketingplan-ts","card":"gamemarketingplan-cm","at":20465,"len":180,"lane":1},{"id":"gamemarketingplan-tt","card":"gamemarketingplan-cn","at":20518,"len":14,"lane":2},{"id":"gamemarketingplan-tu","card":"gamemarketingplan-co","at":20558,"len":7,"lane":0},{"id":"gamemarketingplan-tv","card":"gamemarketingplan-cp","at":20608,"len":7,"lane":2},{"id":"gamemarketingplan-tw","card":"gamemarketingplan-cq","at":20641,"len":7,"lane":0}]}},{"id":"gamemarketingplan-cl","type":"note","x":40,"y":1355,"w":226,"h":87,"title":"Announce","body":"Trailer + store page.","color":"sand","tags":[],"comments":[],"items":[],"url":"","media":"","filename":"","boardId":null},{"id":"gamemarketingplan-cm","type":"note","x":286,"y":1355,"w":226,"h":87,"title":"Weekly GIFs","body":"Every Tuesday.","color":"paper","tags":[],"comments":[],"items":[],"url":"","media":"","filename":"","boardId":null},{"id":"gamemarketingplan-cn","type":"note","x":532,"y":1355,"w":226,"h":87,"title":"Demo festival","body":"","color":"sand","tags":[],"comments":[],"items":[],"url":"","media":"","filename":"","boardId":null},{"id":"gamemarketingplan-co","type":"note","x":778,"y":1355,"w":226,"h":87,"title":"Release date","body":"Trailer #2.","color":"sand","tags":[],"comments":[],"items":[],"url":"","media":"","filename":"","boardId":null},{"id":"gamemarketingplan-cp","type":"note","x":1024,"y":1355,"w":226,"h":87,"title":"Creator keys","body":"Two weeks early.","color":"paper","tags":[],"comments":[],"items":[],"url":"","media":"","filename":"","boardId":null},{"id":"gamemarketingplan-cq","type":"note","x":1270,"y":1355,"w":226,"h":87,"title":"Launch","body":"PC + Switch.","color":"sage","tags":[],"comments":[],"items":[],"url":"","media":"","filename":"","boardId":null}],"edges":[],"view":{"x":60,"y":50,"zoom":0.8},"updated":0,"template":{"id":"lib-game-marketing-plan","version":"1.0.0"}}]}